{
  "schema": "privometry.riskfeed/v1",
  "feed": "community",
  "kind": "snapshot",
  "sequence": 4180,
  "published_at": "2026-10-23T00:00:00.000Z",
  "expires_at": "2026-10-30T00:00:00.000Z",
  "methodology_version": "1.0.0",
  "entries": [
    {
      "component_id": "mcp_01J8MCPGH0000000000000000A",
      "kind": "mcp_server",
      "source": {
        "ecosystem": "npm",
        "name": "@modelcontextprotocol/server-github",
        "publisher": "modelcontextprotocol"
      },
      "versions": [
        {
          "version": "2025.4.8",
          "digest": "sha256:3333333333333333333333333333333333333333333333333333333333333333",
          "tool_manifest_hash": "sha256:4444444444444444444444444444444444444444444444444444444444444444"
        }
      ],
      "score": 31,
      "level": "medium",
      "signals": [
        "network_egress",
        "credential_access"
      ],
      "score_breakdown": {
        "capability": {
          "points": 18,
          "signals": [
            "network_egress",
            "credential_access"
          ]
        },
        "provenance": {
          "points": 4,
          "signals": []
        },
        "behavior": {
          "points": 5,
          "signals": []
        },
        "reputation": {
          "points": 4,
          "signals": []
        }
      },
      "default_verdict": "allow",
      "updated_at": "2026-10-22T00:00:00.000Z",
      "curation": "community"
    },
    {
      "component_id": "mcp_01J8MCPSHE11000000000000B0",
      "kind": "mcp_server",
      "source": {
        "ecosystem": "pypi",
        "name": "mcp-shell-runner",
        "publisher": "jdoe"
      },
      "versions": [
        {
          "version": "0.3.1"
        }
      ],
      "score": 68,
      "level": "high",
      "signals": [
        "shell_exec_tool",
        "unpinned_version",
        "new_package",
        "low_adoption"
      ],
      "score_breakdown": {
        "capability": {
          "points": 25,
          "signals": [
            "shell_exec_tool"
          ]
        },
        "provenance": {
          "points": 18,
          "signals": [
            "unpinned_version"
          ]
        },
        "behavior": {
          "points": 10,
          "signals": []
        },
        "reputation": {
          "points": 15,
          "signals": [
            "new_package",
            "low_adoption"
          ]
        }
      },
      "advisories": [
        {
          "id": "PRIVOMETRY-ADV-2026-0042",
          "aliases": [
            "GHSA-xxxx-yyyy-zzzz"
          ],
          "severity": "high",
          "cvss": {
            "version": "3.1",
            "vector": "CVSS:3.1/AV:N/AC:L/PR:N/UI:R/S:U/C:H/I:H/A:N",
            "score": 8.1
          },
          "summary": "Command injection through the cwd argument.",
          "affected": ">=0.1.0 <0.3.2",
          "fixed": [
            "0.3.2"
          ],
          "references": [
            "https://github.com/advisories/GHSA-xxxx-yyyy-zzzz"
          ],
          "published_at": "2026-10-20T00:00:00.000Z"
        }
      ],
      "default_verdict": "ask",
      "updated_at": "2026-10-22T00:00:00.000Z",
      "curation": "community"
    }
  ]
}
